443,243,"Libeccio","リベッチオ",2,61,31531,0,347,30,170,100,0,0,0,0,0,15,30,19,21,9,27,22,58,11,41,7,18,30,30,60,83,83,48,48,82,108,108,7,7,20,29,29,12,59,10,1,6,2,0,0,0,0,0,147,-1,-1,-1,-1,23,1,1,6,0,1,1,0,0,"ブォンジョールノ！<br>マエストラーレ級駆逐艦、リベッチオです。<br>リベでいいよ。提督さん、よろしくね！","イタリア海軍の駆逐艦、マエストラーレ級三番艦、リ<br>ベッチオです。提督さん、よろしくね！<br>え、タラント空襲？余裕です！船団護衛でも頑張りた<br>かったけど…救助中はやめてほしいよ～！",15,20,1,"nsutzbtifaji",33,10,827
444,244,"Aquila","アクィラ",11,68,31111,0,365,45,880,1000,0,0,0,0,0,38,60,43,45,0,14,0,0,18,48,18,38,0,0,0,0,0,34,34,58,76,76,30,30,52,68,68,5,29,10,1,7,3,10,26,15,0,0,184,-1,-1,-1,-1,240,5,8,18,8,1,0,3,2,"Buon Giornov！<br>地中海生まれの航空母艦Aquilaです。<br>活躍する……はずですー。楽しみにしてて！","地中海ジェノヴァで建造されていたパスタの国の航空<br>母艦、Aquilaですー。<br>貨客船改装空母ではありますがー、大規模な改装で正<br>規空母に近い性能を発揮した……はず。ねえ、グラー<br>フ、アカーギ！聞いてますー？",40,45,1,"beymvxmvhoct",1,1,827
445,245,"秋津洲","あきつしま",16,59,6071,0,450,35,700,350,0,0,0,0,0,32,44,37,39,6,18,0,0,12,36,9,25,0,0,0,0,0,32,32,57,76,76,22,22,42,57,57,12,59,5,1,7,2,1,1,0,0,0,10,39,-1,-1,-1,70,3,1,7,4,0,0,1,1,"水上機母艦、秋津洲よ！<br>この大艇ちゃんと一緒に覚えてよね！","あたしが水上機母艦、秋津洲よ！<br>そう、大型飛行艇の運用支援や洋上補給のために建造<br>された、飛行艇母艦。え、迷彩が厚化粧？　ホントに<br>失礼かも。二式大艇ちゃんはあげないからね！",50,10,1,"oswtwcbzgbfm",24,13,827
446,246,"Italia","リットリオ・イタリア",8,58,31012,441,0,0,0,0,0,0,0,0,1,92,98,98,98,81,102,0,0,44,90,77,92,0,0,0,0,0,35,35,76,107,107,17,17,52,78,78,30,79,10,4,7,4,3,3,3,3,0,137,134,135,-1,-1,300,18,28,39,7,5,0,2,3,"ヴィットリオ・ヴェネト級戦艦二番艦、リットリオ改め、イタリアです。<br>よろしくお願いしますね。","パスタの国で生まれました。ヴィットリオ・ヴェネト<br>級戦艦２番艦、リットリオ改め、イタリアです。<br>高速で兵装も充実した新鋭高速戦艦です。妹のローマ<br>共々、どうぞよろしくお願い致します。",140,170,7,"feyfhhruhjse",35,12,827
447,247,"Roma改","ローマ",8,58,31022,442,0,0,0,0,0,0,0,0,1,92,98,98,98,82,105,0,0,46,94,76,90,0,0,0,0,0,32,32,71,100,100,17,17,52,78,78,8,57,10,4,7,4,3,3,3,3,0,137,134,135,-1,-1,300,18,28,39,7,5,0,2,3,"ヴィットリオ・ヴェネト級戦艦４番艦、ローマです、よろしく。<br>何？あまりジロジロ見ないでくださいね。","イタリア生まれの最新鋭艦よ。ヴィットリオ・ヴェネ<br>ト級戦艦４番艦、ローマ。<br>そうね、あの時は姉さんと一緒だったわ。あの化け物<br>を落とされた日。忘れないわ、あの痛み。絶対忘れな<br>いんだから。",140,170,3,"yfpnftpuwkrx",23,14,827
448,248,"Zara","ザラ",5,64,31311,0,358,40,420,280,0,0,0,0,0,42,55,48,50,36,58,0,28,18,62,36,54,0,0,0,0,0,33,33,59,78,78,10,10,36,55,55,10,48,10,3,6,3,2,2,2,0,0,162,-1,-1,-1,-1,70,2,2,11,2,3,0,0,2,"Buon Giornov！ ザラ級重巡、一番艦ザラです！<br>粘り強さが信条です。提督、よろしくね！","ザラ級重巡洋艦、その一番艦、ザラです。巡洋艦同士<br>の昼間水上砲戦なら、誰にも負けない自負はありま<br>す。妹のポーラが少し心配だけど、この艦隊なら！提<br>督、頑張りましょう！<br>重巡ザラ、艦隊に参加します！",45,60,1,"spmuptretooz",10,2,827
449,249,"Pola","ポーラ",5,64,31321,0,361,40,440,270,0,0,0,0,0,42,55,48,50,35,59,0,32,16,64,35,53,0,0,0,0,0,32,32,58,77,77,9,9,35,54,54,9,49,10,3,6,3,2,2,2,0,0,162,-1,-1,-1,-1,70,2,2,11,2,3,0,0,2,"Buon Giornov～。<br>ザラ級重巡の三番艦～、ポーラです～。<br>何にでも挑戦したいお年頃。頑張ります～。","ザラ級重巡洋艦の三番艦、ポーラです～。皆さん、覚<br>えてくださいね～。装甲と防御重視の優れた重巡さん<br>なんです～。水上戦闘にちゃんと出撃したんですよ<br>～。でも～、戦艦には勝てません～。飲むしかないで<br>す～。",45,60,1,"zbwwxnwyxhps",7,1,827
450,250,"秋津洲改","あきつしま",16,59,6072,445,0,0,0,0,0,0,0,0,1,36,48,41,43,8,28,0,0,16,44,13,42,0,0,0,0,0,35,35,64,86,86,24,24,54,77,77,14,72,5,1,8,3,1,1,1,0,0,138,40,-1,-1,-1,70,3,1,7,6,0,0,2,1,"水上機母艦、秋津洲よ！<br>この大艇ちゃんと一緒に覚えてよね！","あたしが水上機母艦、秋津洲よ！<br>そう、大型飛行艇の運用支援や洋上補給のために建造<br>された、飛行艇母艦。え、迷彩が厚化粧？　ホントに<br>失礼かも。二式大艇ちゃんはあげないからね！",60,15,3,"wwqmolrsxfvz",24,13,827
451,251,"瑞穂","みずほ",16,62,6051,0,348,40,220,160,0,0,0,0,0,41,59,47,49,12,36,0,32,16,32,19,42,0,0,0,0,0,19,19,37,50,50,36,36,74,103,103,8,39,5,1,5,2,12,12,0,0,0,10,59,-1,-1,-1,140,3,2,12,5,1,0,1,2,"提督、お疲れさまです。<br>水上機母艦、瑞穂、推参致しました。<br>どうぞよろしくお願い申し上げます。","水上機母艦、瑞穂です。千歳、千代田に続いて建造さ<br>れた、甲標的も運用可能な特殊水上機母艦です。新機<br>軸の機関部があまり上手くいかなくって……でも、開<br>戦初頭の南方作戦などに参加致しました。お役に立て<br>るよう頑張りますね！",35,35,1,"zqwwomufsbpq",74,10,827
452,252,"沖波","おきなみ",2,38,16331,0,359,30,130,110,0,0,0,0,0,16,34,20,22,10,30,24,69,9,38,6,19,28,28,53,72,72,47,47,80,105,105,7,7,21,31,31,10,49,10,1,4,2,0,0,0,0,0,2,39,-1,-1,-1,24,1,1,6,0,0,1,0,1,"夕雲型駆逐艦十四番艦の……沖波です。<br>えっと…はい、頑張ります。よろしくお願い致します！","夕雲型駆逐艦、その十四番艦の沖波です。<br>マル急計画で建造されました。はい、生まれ故郷は舞<br>鶴です。もうその頃前線は崩れ始めていて……それで<br>も、主力艦隊の護衛や船団護衛に、私、頑張りました<br>…はい！",15,20,1,"xxnlcxflgfji",53,3,827
453,253,"風雲","かざぐも",2,38,16221,0,349,30,140,120,0,0,0,0,0,16,34,20,22,10,30,25,70,10,40,6,19,27,27,52,71,71,47,47,80,105,105,6,6,19,28,28,13,54,10,1,4,2,0,0,0,0,0,2,39,-1,-1,-1,24,1,1,6,0,0,1,0,1,"夕雲型駆逐艦、三番艦の風雲よ。<br>そっか、貴方が提督なんだ。了解です。<br>ご命令、どうぞ！","艦隊型駆逐艦、夕雲型駆逐艦の三番艦、風雲よ、よろ<br>しく。<br>あのミッドウェーからソロモンまで、主戦場を駆けた<br>のよ。運命の日の夜、燃える空母を見上げたの。龍の<br>最期、忘れない。",15,20,1,"xooelfidumnp",58,9,827
454,254,"嵐","あらし",2,30,16161,0,354,35,140,110,0,0,0,0,0,16,34,20,22,10,29,24,69,9,39,6,19,28,28,62,88,88,44,44,79,105,105,6,6,19,28,28,11,49,10,1,5,2,0,0,0,0,0,2,44,-1,-1,-1,24,1,1,6,0,0,1,0,1,"や！　陽炎型駆逐艦、十六番艦、嵐だ！<br>司令、よろしくな！　逢えて嬉しいぜ！","陽炎型駆逐艦十六番艦、嵐だ。第四駆逐隊を編成し<br>て、四水戦で活躍したぜ。ミッドウェーでは、南雲機<br>動部隊の護りについたんだ。その後も最前線を縦横無<br>尽に駆け抜けて……最期の時は、暗い海での前線の輸<br>送作戦。僚艦の萩風と一緒さ。嵐、そして四駆の仲間<br>たち……覚えていてくれよな。頼むぜ。",15,20,1,"nguivbnbevwd",8,8,827
455,255,"萩風","はぎかぜ",2,30,16171,0,355,35,140,110,0,0,0,0,0,16,34,20,22,11,30,24,69,9,39,6,19,26,26,59,84,84,44,44,79,105,105,6,6,19,28,28,11,49,10,1,5,2,0,0,0,0,0,2,39,-1,-1,-1,24,1,1,6,0,0,1,0,1,"陽炎型駆逐艦、十七番艦、萩風。参りました。<br>司令、ご指示をお願いします。","陽炎型駆逐艦十七番艦、萩風です。浦賀生まれです。<br>嵐と一緒に第四駆逐隊で頑張りました。南雲機動部隊<br>の直衛、ソロモンの死闘を経験しました。最期の夜も<br>…嵐と一緒です。私たち、四駆のこと、覚えていてく<br>ださいね。",15,20,1,"xxbsgzxwjqxh",8,8,827
456,256,"親潮","おやしお",2,30,16041,0,362,35,140,110,0,0,0,0,0,16,34,20,22,10,30,24,68,9,37,6,19,23,23,47,65,65,44,44,79,105,105,8,8,19,27,27,13,50,10,1,5,2,0,0,0,0,0,2,14,-1,-1,-1,24,1,1,6,0,0,1,0,1,"陽炎型駆逐艦四番艦、親潮です。<br>司令、第十五駆逐隊、どうぞよろしく<br>ご指導ください。お願いいたします！","陽炎型駆逐艦、第四番艦、親潮です。舞鶴生まれで<br>す。僚艦の黒潮さんらと共に、第十五駆逐隊を編成し<br>ました。攻略作戦や航空母艦の護衛、鼠輸送も何度も<br>経験しました。<br>最期の出撃も……黒潮さんと一緒です。",15,20,1,"dvcslbfkmdsy",1,1,827
457,257,"山風","やまかぜ",2,23,15141,0,369,45,180,100,0,0,0,0,0,16,32,20,22,11,31,24,69,8,38,6,19,19,19,42,59,59,42,42,77,103,103,5,5,18,27,27,6,39,10,1,4,2,0,0,0,0,0,2,-1,-1,-1,-1,22,1,1,5,0,0,1,0,0,"あたし…白露型駆逐艦……その八番艦。山風。<br>いいよ……。別に。","白露型駆逐艦八番艦、改白露型、山風。<br>浦賀生まれ……。時雨姉や涼風と同じ……。<br>江風たちと第二十四駆逐隊を編成した……。加賀の護<br>衛をしたりね、大きな戦いでも最初の方はね、随分頑<br>張ったよ。そしてね。大湊から柱島にね。行こうとし<br>たの。その後はね……わからない。覚えてないの。",15,20,1,"tvieoobotato",22,1,827
458,258,"海風","うみかぜ",2,23,15131,0,350,30,150,100,0,0,0,0,0,16,32,20,22,10,29,24,69,10,40,6,19,23,23,50,70,70,44,44,79,105,105,6,6,19,28,28,10,49,10,1,4,2,0,0,0,0,0,2,-1,-1,-1,-1,22,1,1,5,0,0,1,0,0,"白露型駆逐艦七番艦、<br>そして改白露型一番艦となる、海風です。<br>提督、どうぞよろしくお願いします！","白露型駆逐艦七番艦、改白露型としては一番艦となる<br>海風です。<br>マル２計画によって建造されました。第二水雷戦隊の<br>一翼として、ソロモン海の戦いにも参加しました。提<br>督、どうぞよろしくお願い致します。",15,20,1,"rnmsjjndxlgj",54,12,827
459,259,"江風","かわかぜ",2,23,15151,0,351,30,150,100,0,0,0,0,0,16,32,20,22,10,29,25,70,9,39,6,19,21,21,49,70,70,44,44,79,105,105,6,6,19,28,28,10,49,10,1,4,2,0,0,0,0,0,2,-1,-1,-1,-1,22,1,1,5,0,0,1,0,0,"白露型駆逐艦九番艦、<br>改白露型の江風だよ。よろしくな！<br>あ、読み方、間違えンなよ。","白露型九番艦、改白露型駆逐艦の江風だ。<br>そうさ、海風の姉貴たちと同じ、マル２計画で建造さ<br>れたよ。まー、働いた働いた。ソロモン海は何度も駆<br>け回ったよ。最期は夜戦さ。敵さんの電探…ありゃー<br>反則さ。",15,20,1,"jdpiljspxgpz",29,11,827
460,260,"速吸","はやすい",22,60,7111,0,352,25,200,270,0,0,0,0,0,43,50,49,50,4,22,0,0,10,32,3,15,5,5,20,31,31,9,9,28,42,42,15,15,40,59,59,7,39,5,1,6,2,6,1,0,0,0,26,146,-1,-1,-1,220,6,0,20,1,0,0,1,1,"おはようございます！<br>航空機搭載給油艦、速吸です！<br>皆さんのサポート、頑張ります！","艦隊随伴型の給油艦、速吸です。よろしくお願いしま<br>す！<br>様々な物資を補給できる多用途給油艦でありながら、<br>航空機の運用が可能な設計です。ミッドウェー海戦後<br>の計画変更で流星の発進も可能となりました！",100,15,1,"ajggcaaaocgh",13,21,827
461,261,"翔鶴改二","しょうかく",11,33,2056,288,466,88,1700,5700,0,0,0,0,2,77,93,85,87,0,63,0,0,48,88,43,77,0,0,0,0,0,39,39,84,118,118,48,56,93,121,127,20,97,10,2,8,4,27,27,27,12,0,-1,-1,-1,-1,-1,360,12,16,38,17,0,0,5,5,"翔鶴型航空母艦１番艦、翔鶴です。<br>一航戦、二航戦の先輩方に、少しでも近づけるように<br>瑞鶴と一緒に頑張ります！","翔鶴型航空母艦１番艦の翔鶴です。<br>軍縮条約失効後に設計建造された、本格的な大型正規<br>空母として就役しました。妹の瑞鶴と共に第五航空戦<br>隊を編成します。あの惨劇の後は、先輩方の後を継い<br>で戦線を支えました。そして今、マリアナを超えて、<br>提督と共に翔び続けたいと思います。",90,85,3,"hpxsthymxmki",19,19,827
462,262,"瑞鶴改二","ずいかく",11,33,2066,112,467,90,1700,5750,0,0,0,0,2,78,93,86,88,0,56,0,0,54,90,44,78,0,0,0,0,0,48,48,89,120,120,52,52,92,122,122,50,99,10,2,8,4,28,26,26,13,0,-1,-1,-1,-1,-1,360,12,16,38,17,0,0,5,5,"翔鶴型航空母艦２番艦、妹の瑞鶴です。<br>幸運の空母ですって？そうじゃないの、一生懸命やってるだけ…よ。艦載機がある限り、負けないわ！","翔鶴型航空母艦２番艦、瑞鶴です。<br>翔鶴姉と共にミッドウェーの後の第一機動部隊の中核<br>として、矢尽き刀折れるまで奮戦しました。文字通<br>り、最後の機動部隊が壊滅する、その日まで。でも、<br>今度は違うの。改装された本格正規空母の力、存分に<br>魅せるわ！翔鶴姉、やろう！",90,85,3,"giytrybpknos",19,21,827
463,263,"朝潮改二","あさしお",2,18,15176,248,468,85,390,360,0,0,0,0,2,31,53,36,38,18,68,36,92,22,60,14,52,26,26,59,84,84,49,49,90,121,121,11,11,57,92,92,17,70,10,1,6,3,0,0,0,0,0,-1,-1,-1,-1,-1,22,1,2,10,0,2,2,1,1,"駆逐艦、朝潮です。<br>勝負ならいつでも受けて立つ覚悟です。","朝潮型駆逐艦のネームシップ、朝潮よ。<br>バランスのとれた量産型駆逐艦として建造され、戦線<br>を支えたの。<br>私の進化改良型が陽炎型になるわね。",15,20,3,"grmdtyheocuc",14,19,827
464,264,"霞改二","かすみ",2,18,15266,253,470,88,390,300,0,0,0,0,2,31,53,36,38,16,65,33,92,24,72,14,52,28,28,68,98,98,52,52,90,119,119,14,14,54,84,84,37,97,10,1,6,3,0,0,0,0,0,-1,-1,-1,-1,-1,22,1,2,10,0,2,2,1,1,"霞よ。<br>ガンガンいくわよ。ついてらっしゃい。","歴戦の主力駆逐艦として奮戦したわ。<br>最後は戦艦大和と共に坊ノ岬沖海戦で米艦載機の猛攻<br>と戦ったの。<br>負けないわ！",15,20,1,"mqlroxfnufpz",10,11,827
465,265,"鹿島","かしま",21,56,12021,0,356,35,120,400,0,0,0,0,0,36,48,41,43,13,27,11,24,15,46,9,27,13,13,43,66,66,25,25,51,70,70,9,9,36,56,56,20,69,5,2,3,3,1,1,1,0,0,119,10,44,-1,-1,70,3,1,10,0,0,1,0,1,"提督さん、お疲れさまです。<br>練習巡洋艦、鹿島、着任です。うふふ。","香取型練習巡洋艦二番艦、妹の鹿島です。平和の海<br>で、次代の艦隊を育てるために建造されました。その<br>本来の役目を果たせる時間はあまり長くはありません<br>でしたが、艦隊旗艦や船団護衛、精一杯頑張りまし<br>た。戦いが終わった後も、未来のために、私、頑張り<br>ました！　鹿島のこと、覚えていてくださいね。",30,15,1,"nwiyrjfnqvux",32,10,827
466,266,"翔鶴改二甲","しょうかく",18,33,2057,461,461,88,1200,4500,0,0,0,0,3,78,94,86,88,0,70,0,0,48,88,49,83,0,0,0,0,0,36,36,81,115,115,50,50,90,120,120,20,97,10,2,8,4,34,21,12,9,0,-1,-1,-1,-1,-1,360,12,16,40,16,0,0,5,6,"翔鶴型航空母艦１番艦、翔鶴です。<br>一航戦、二航戦の先輩方に、少しでも近づけるように<br>瑞鶴と一緒に頑張ります！","翔鶴型航空母艦１番艦の翔鶴です。<br>軍縮条約失効後に設計建造された、本格的な大型正規<br>空母として就役しました。妹の瑞鶴と共に第五航空戦<br>隊を編成します。あの惨劇の後は、先輩方の後を継い<br>で戦線を支えました。そして今、マリアナを超えて、<br>提督と共に翔び続けたいと思います。",100,85,3,"ekuxnovhattm",19,19,827
467,267,"瑞鶴改二甲","ずいかく",18,33,2067,462,462,90,1200,4550,0,0,0,0,3,79,94,87,89,0,65,0,0,54,90,49,84,0,0,0,0,0,44,44,85,116,116,50,50,90,120,120,50,99,10,2,8,4,34,24,12,6,0,-1,-1,-1,-1,-1,360,12,16,40,16,0,0,5,6,"翔鶴型航空母艦２番艦、妹の瑞鶴です。<br>幸運の空母ですって？そうじゃないの、一生懸命やってるだけ…よ。艦載機がある限り、負けないわ！","翔鶴型航空母艦２番艦、瑞鶴です。<br>翔鶴姉と共にミッドウェーの後の第一機動部隊の中核<br>として、矢尽き刀折れるまで奮戦しました。文字通<br>り、最後の機動部隊が壊滅する、その日まで。でも、<br>今度は違うの。改装された本格正規空母の力、存分に<br>魅せるわ！翔鶴姉、やろう！",100,85,3,"qgrxbhuvtrbf",19,21,827
468,268,"朝潮改二丁","あさしお",2,18,15177,463,463,85,360,390,0,0,0,0,3,34,59,39,41,12,55,36,86,30,75,15,55,45,45,89,122,122,47,47,88,119,119,10,10,55,89,89,17,70,10,1,7,3,0,0,0,0,0,-1,-1,-1,-1,-1,22,1,2,10,0,2,2,1,1,"駆逐艦、朝潮です。<br>勝負ならいつでも受けて立つ覚悟です。","朝潮型駆逐艦のネームシップ、朝潮よ。<br>バランスのとれた量産型駆逐艦として建造され、戦線<br>を支えたの。<br>私の進化改良型が陽炎型になるわね。",15,20,3,"schftfqkstxa",14,19,827
469,269,"江風改二","かわかぜ",2,23,15156,351,0,0,0,0,0,0,0,0,2,31,54,36,38,16,62,38,96,18,64,14,51,25,25,63,92,92,51,51,89,118,118,12,13,53,83,84,19,75,10,1,6,3,0,0,0,0,0,63,15,101,-1,-1,22,1,2,10,0,2,2,1,1,"白露型駆逐艦九番艦、<br>改白露型の江風だよ。よろしくな！<br>あ、読み方、間違えンなよ。","白露型九番艦、改白露型駆逐艦の江風だ。<br>そうさ、海風の姉貴たちと同じ、マル２計画で建造さ<br>れたよ。まー、働いた働いた。ソロモン海は何度も駆<br>け回ったよ。最期は夜戦さ。敵さんの電探…ありゃー<br>反則さ。",15,20,3,"rwrhhyeloenn",29,1,827
470,270,"霞改二乙","かすみ",2,18,15267,464,464,88,300,390,0,0,0,0,3,31,53,36,38,12,60,30,83,32,82,15,52,28,28,68,98,98,56,56,92,119,119,11,15,56,87,90,37,97,10,1,7,3,0,0,0,0,0,-1,-1,-1,-1,-1,22,1,2,10,0,1,2,2,1,"霞よ。<br>ガンガンいくわよ。ついてらっしゃい。","歴戦の主力駆逐艦として奮戦したわ。<br>最後は戦艦大和と共に坊ノ岬沖海戦で米艦載機の猛攻<br>と戦ったの。<br>負けないわ！",15,20,1,"vxrvwfxhlbag",10,11,827
471,271,"神風","かみかぜ",2,66,13161,0,476,50,130,80,0,0,0,0,0,12,23,16,18,5,28,12,36,5,26,5,17,20,20,60,90,90,39,39,80,111,111,5,5,18,27,27,30,79,10,1,4,2,0,0,0,0,0,1,174,-1,-1,-1,18,1,1,3,0,1,1,0,0,"待たせたわね、司令官。<br>神風型駆逐艦、一番艦、神風。推参です！<br>みんな、いい？　ついてらっしゃい！","神風型駆逐艦一番艦、神風です。八八艦隊計画の時代<br>に建造された艦隊型駆逐艦、そのネームシップです。<br>睦月型の前級にあたる私達だけれど、あの戦いを最後<br>まで駆け抜けたのよ。<br>私達のことも、覚えていてね。",15,15,1,"xqqqhgvzjuae",8,1,827
472,272,"朝風","あさかぜ",2,66,13171,0,370,50,150,80,0,0,0,0,0,12,23,16,18,5,29,12,37,6,27,5,17,17,17,55,84,84,37,37,72,98,98,6,6,19,28,28,13,72,10,1,4,2,0,0,0,0,0,1,174,-1,-1,-1,18,1,1,3,0,1,1,0,0,"おはよう！　朝風よ。神風型駆逐艦二番艦、朝風。<br>司令官？　早く覚えなさい！　いい？","神風型駆逐艦二番艦の朝風よ。長崎生まれ。妹の春風<br>たちと一緒に、歴史ある第五駆逐隊を編成したわ。旗<br>艦は当然私。緒戦の海戦や攻略戦に参加したわ。もち<br>ろん、大切な船団護衛もしっかりきっちりやりきった<br>わよ。<br>うん……やるだけ、やったんだから！",15,15,1,"fmsaumjkejlm",2,1,827
473,273,"春風","はるかぜ",2,66,13181,0,363,50,110,80,0,0,0,0,0,12,23,16,18,5,27,12,36,6,28,5,17,18,18,56,85,85,38,38,74,101,101,4,4,17,26,26,25,74,10,1,4,2,0,0,0,0,0,1,174,-1,-1,-1,18,1,1,3,0,1,1,0,0,"神風型駆逐艦の三番艦、春風と申します。<br>司令官様、どうぞお見知りくださいませ。","神風型駆逐艦の三番艦、春風と申します。舞鶴生まれ<br>です。<br>以前は第五駆逐艦とも呼ばれていたのですが、春風と<br>いう大切な名前を頂きました。第五駆逐隊、そして第<br>一海上護衛隊に所属して、皆さんをお守りしました。<br>戦いが終わった後も…お守りします。",15,15,1,"gfogtnmgovlq",1,1,827
474,274,"松風","まつかぜ",2,66,13191,0,371,50,130,80,0,0,0,0,0,12,23,16,18,5,28,12,38,5,25,5,17,21,21,62,93,93,36,36,73,101,101,4,4,18,28,28,12,70,10,1,4,2,0,0,0,0,0,1,174,-1,-1,-1,18,1,1,3,0,1,1,0,0,"僕が神風型駆逐艦四番艦、松風だ。キミが僕の司令官か。<br>いいね。僕の背中は任せたよ！<br>さあ、一緒に行こう！","神風型駆逐艦、その四番艦、松風だ。旧式だって？<br>は！冗談じゃない。攻略作戦から南方ソロモン方面の<br>最前線、そして船団護衛まで、戦線を支えた僕たちを<br>忘れようったって、そうはいかないさ。<br>神風型の仲間達、そしてこの松風、忘れんなよ。<br>頼んだぜ。",15,15,1,"uesladlyqrru",1,1,827
475,275,"旗風","はたかぜ",2,66,13201,0,387,50,130,80,0,0,0,0,0,12,23,16,18,5,29,12,36,5,24,5,17,17,17,56,85,85,37,37,75,104,104,4,4,17,26,26,17,73,10,1,4,2,0,0,0,0,0,1,174,-1,-1,-1,18,1,1,3,0,1,1,0,0,"司令、神風型駆逐艦、旗風、参りました。<br>お供させて頂きます。よろしくお願い致します。","神風型駆逐艦五番艦、旗風と申します。<br>春風姉さん達と一緒に第五駆逐隊を編成し、お勤めさ<br>せていただきました。主力艦の護衛や、船団護衛に努<br>めました。戦いの後半の護送船団航路は……。護衛艦<br>艇も多く喪われていきました。",15,15,1,"sbvnvwfihmrd",1,1,827
476,276,"神風改","かみかぜ",2,66,13162,471,0,0,0,0,0,0,0,0,1,23,38,27,29,8,41,14,68,14,48,10,38,24,24,70,105,105,60,60,98,127,127,7,7,42,68,68,40,99,10,1,6,3,0,0,0,0,0,1,174,28,-1,-1,18,1,1,4,0,1,1,0,0,"司令官、私、頑張るから！<br>神風型駆逐艦、一番艦、神風。推参です！<br>全力で事に当たりましょう！","神風型駆逐艦一番艦、神風です。八八艦隊計画の時代<br>に建造された艦隊型駆逐艦、そのネームシップです。<br>睦月型の前級にあたる私達だけれど、あの戦いを最後<br>まで駆け抜けたのよ。<br>私達のことも、覚えていてね。",15,15,3,"osxrcrtldvru",8,1,827
477,277,"天龍改二","てんりゅう",3,21,10016,213,0,0,0,0,0,0,0,0,2,42,56,48,50,22,64,0,78,40,89,29,63,24,24,70,105,105,42,42,82,112,112,11,13,53,83,85,17,77,10,1,7,3,1,1,1,0,0,91,91,229,-1,-1,60,1,2,9,0,1,1,2,2,"","天龍型１番艦、天龍だ。<br>駆逐艦を束ねて、殴り込みの水雷戦隊を率いるぜ。<br>相棒は、同型艦の龍田だ。<br>あいつ、ちゃんとやってるかな？ま、いいけどな。",25,25,1,"aoprntdhsoqa",23,2,827
478,278,"龍田改二","たつた",3,21,10026,214,0,0,0,0,0,0,0,0,2,42,56,48,50,13,50,20,80,32,80,29,63,50,50,82,106,106,42,42,84,116,116,9,10,52,84,85,18,79,10,1,7,3,1,1,1,0,0,91,45,174,-1,-1,60,1,2,9,0,1,1,2,2,"","軽巡洋艦、天龍型２番艦の龍田よ。<br>生まれは佐世保なの。<br>天龍ちゃんがみんなに迷惑かけてない？心配よね～。<br>え？私？私は潜水艦が、ちょっと鬼門だわ～。",25,25,1,"usewjvwytald",23,1,827
479,279,"天霧","あまぎり",2,1,14151,0,390,35,170,130,0,0,0,0,0,15,29,19,21,10,30,27,70,12,39,5,20,20,20,49,71,71,41,41,80,109,109,5,5,20,31,31,11,57,10,1,4,2,0,0,0,0,0,2,-1,-1,-1,-1,20,1,1,5,0,0,1,0,0,"さあ、いってみよう！<br>綾波型駆逐艦、天霧だ。よろしくな、提督！","綾波型駆逐艦、五番艦の天霧だ。そう、重武装の特型<br>駆逐艦だぜ。微妙に旧式だって？馬鹿いうな。各作戦<br>やソロモンの夜を駆け抜けたあたしだよ？そうさ、大<br>統領になる男を水もしたたるいい男にしてやったこと<br>もある。出逢いってのは面白いな！",15,20,0,"xvgcgmwruygk",19,1,827
480,280,"狭霧","さぎり",2,1,14161,0,391,30,130,110,0,0,0,0,0,15,29,19,21,10,29,27,69,12,39,5,19,20,20,49,71,71,40,40,79,108,108,5,5,19,29,29,6,46,10,1,4,2,0,0,0,0,0,2,-1,-1,-1,-1,20,1,1,5,0,0,1,0,0,"提督、あの、私……<br>綾波型駆逐艦……狭霧といいます。<br>お手伝いできるよう、頑張ります。","綾波型駆逐艦、六番艦の狭霧です。そうですね、吹雪<br>型一番艦から数えて十六隻目の特型駆逐艦です。天霧<br>たちと第二十駆逐隊を編成し、三水戦の一翼を担いま<br>した。あまり多くの戦いを経験してはいませんが、お<br>味方のために尽くしたいと思います。",15,20,0,"tbgbgvlvagls",29,1,827
